En,Zh,Ja,Ko,Id,De,Fr,Ru,It
Home,首页,ホーム,집,Rumah,Startseite,Accueil,Главная страница,Casa
A pixel NFT project from official N1Swap team,来自N1Swap官方团队的像素NFT项目。,N1Swap公式チームによるピクセルNFTプロジェクト,공식 N1Swap 팀의 픽셀 NFT 프로젝트,Sebuah proyek pixel NFT dari tim N1Swap resmi,Ein Pixel-NFT-Projekt vom offiziellen N1Swap-Team,Un projet pixel NFT de l'équipe officielle de N1Swap,Пиксельный проект NFT от официальной команды N1Swap,Un progetto NFT in pixel dal team ufficiale di N1Swap
"N1Swap,next TRX decentralized exchange worth investing in","N1Swap,下一个值得投资的TRX去中心化交易所。","N1Swap,next TRX分散型取引所に投資する価値がある。","N1Swap, 다음 TRX는에서 교환 가치 투자를 분산","N1Swap, TRX berikutnya desentralisasi pertukaran bernilai investasi di","N1Swap, die nächste dezentrale TRX-Börse, in die es sich zu investieren lohnt","N1Swap, le prochain échange décentralisé TRX dans lequel il vaut la peine d'investir.","N1Swap, следующая децентрализованная биржа TRX стоит инвестировать в","N1Swap, il prossimo scambio decentralizzato TRX in cui vale la pena investire"
Base on TRX network,以TRX网络为基础,TRXネットワークに基づく,TRX 네트워크에 대한 자료,Berdasarkan jaringan TRX,Basis auf TRX-Netzwerk,Basé sur le réseau TRX,База на сети TRX,Base sulla rete TRX
low transaction GAS,低交易量GAS,低トランザクションGAS,낮은 거래 GAS,GAS transaksi yang rendah,niedrige Transaktion GAS,faible transaction GAS,низкая транзакция GAS,bassa transazione GAS
NST holder,NST持有人,NSTホルダー,NST 홀더,pemegang NST,NST-Inhaber,Détenteur de NST,держатель NST,Titolare NST
"Liquidity providers will receive a 0.25% transaction fee rate,NST holders receive a 0.05% transaction fee rate",流动资金提供者将收取0.25%的交易费率，NST持有人将收取0.05%的交易费率。,流動性提供者には0.25%の取引手数料、NST保有者には0.05%の取引手数料を提供,"유동성 공급자는 NST 홀더는 0.05 %의 거래 수수료 율을 받고, 0.25 % 거래 수수료 비율을 받게됩니다","penyedia likuiditas akan menerima tingkat biaya transaksi 0,25%, pemegang NST menerima tingkat biaya transaksi 0,05%","Liquiditätsanbieter erhalten eine 0,25%ige Transaktionsgebühr, NST-Inhaber erhalten 0,05% Transaktionsgebühr","Les fournisseurs de liquidité recevront un taux de frais de transaction de 0,25%, les détenteurs de NST recevront un taux de frais de transaction de 0,05%.","Ликвидные провайдеры получат ставку комиссии за транзакцию в размере 0,25%, держатели NST получат ставку комиссии за транзакцию в размере 0,05%.","I fornitori di liquidità riceveranno un tasso di tassa di transazione dello 0,25%, i titolari di NST ricevono un tasso di tassa di transazione dello 0,05%"
Lower Stablecoin trading slippage,稳定币交易下滑,ステーブルコイン取引のスリッページが少ない,낮은 Stablecoin 거래 미끄러짐,perdagangan selip rendah Stablecoin,Geringere Stablecoin-Handelsslippage,Moins de dérapage dans la négociation du Stablecoin,Нижнее проскальзывание торговли Stablecoin,Minore slippage di trading di Stablecoin
Stablecoin trading pairs use a lower slippage algorithm (similar to Curve.fi),稳定币交易对使用较低的滑点算法（类似Curve.fi）。,ステーブルコインの取引ペアは、より低いスリッページアルゴリズムを使用しています（Curve.fiに似ています）。,Stablecoin 거래 쌍 (Curve.fi 유사) 낮은 슬립 알고리즘을 사용,pasang perdagangan Stablecoin menggunakan algoritma slip rendah (mirip dengan Curve.fi),Stablecoin-Handelspaare verwenden einen niedrigeren Slippage-Algorithmus (ähnlich wie Curve.fi),Les paires d'échange de Stablecoin utilisent un algorithme de slippage inférieur (similaire à Curve.fi).,Торговые пары Stablecoin используют алгоритм более низкого проскальзывания (аналогично Curve.fi).,Le coppie di trading Stablecoin utilizzano un algoritmo di slippage inferiore (simile a Curve.fi)
"Coming in End of April, Get Free NST Airdop now",即将在4月底推出，现在就可以免费获得NST Airdop。,4月末発売予定、無料のNST Airdopを手に入れよう,"4 월 끝에서오고, 지금 무료 NST Airdop 받기","Datang di Akhir April, Dapatkan Gratis NST Airdop sekarang","Kommt Ende April, jetzt kostenloses NST Airdop erhalten","A venir à la fin du mois d'avril, obtenez un NST Airdop gratuit maintenant.","Приезжая в конце апреля, получите бесплатный NST Airdop прямо сейчас.","In arrivo alla fine di aprile, ottieni ora NST Airdop gratuito"
Submit your Trx address,提交您的Trx地址,あなたのTrxアドレスを送信,당신의 송수신 주소를 제출,Mengirimkan alamat Trx Anda,Senden Sie Ihre Trx-Adresse,Soumettez votre adresse Trx,Отправьте свой Trx-адрес,Invia il tuo indirizzo Trx
you can submit your address and get NST airdrops for free,您可以提交您的地址并免费获得NST空投。,あなたのアドレスを送信し、無料でNSTエアドロップを得ることができます。,당신은 당신의 주소를 입력하고 무료 NST의 airdrops를 얻을 수 있습니다,Anda dapat mengirimkan alamat Anda dan mendapatkan airdrops NST gratis,Sie können Ihre Adresse einreichen und erhalten NST Airdrops kostenlos,Vous pouvez soumettre votre adresse et obtenir des largages NST gratuitement.,вы можете отправить свой адрес и получить NST капельницы бесплатно.,puoi inviare il tuo indirizzo e ottenere NST airdrops gratis
Submit,提交,送信,제출,Kirimkan,Einreichen,Soumettre,Отправить .,Invia
Join in our community,加入我们的社区,私たちのコミュニティに参加する,우리 지역 사회에 참여하기,Bergabung dalam komunitas kami,Werden Sie Mitglied in unserer Community,Rejoignez notre communauté,Присоединяйтесь к нашему сообществу,Unisciti alla nostra comunità
Join our community get 1 NST more,加入我们的社区获得1个NST 更多,コミュニティに参加すると、NSTを1回多くもらえます。,우리 사회가 더 한 NST를받을 가입,Bergabung dengan komunitas kami mendapatkan 1 NST lebih,Werden Sie Mitglied in unserer Community und erhalten Sie 1 NST mehr,Rejoignez notre communauté et recevez 1 NST en plus,Присоединяйтесь к нашему сообществу и получите 1 NST больше,Unisciti alla nostra comunità ottenere 1 NST più
Share in Twitter or FB,在Twitter或FB上分享,ツイッターやFBでシェア,트위터 나 FB으로 공유하기,Berbagi di Twitter atau FB,Teilen Sie in Twitter oder FB,Partagez sur Twitter ou FB,Поделиться в Twitter или FB,Condividi su Twitter o FB
"if someone fill the airdop with your share url, you will get 10 NFT more.",如果有人将你的分享网址填入airdop，你将获得10个NFT。,誰かがあなたのシェアURLでエアドロップを埋めれば、10NFT追加されます。,"누군가가 공유 URL로 airdop을 채울 경우, 당신은 더 많은 노퍽 표준시 01시을 얻을 것이다.","jika seseorang mengisi airdop dengan url berbagi Anda, Anda akan mendapatkan 10 NFT lebih.","wenn jemand den Airdop mit Ihrer Share-Url füllt, erhalten Sie 10 NFT mehr.","si quelqu'un remplit l'airdop avec votre url de partage, vous obtiendrez 10 NFT de plus.","если кто-нибудь наполнит птичник твоей урной с долей, ты получишь еще 10 NFT.","se qualcuno riempie l'airdop con il tuo url di condivisione, otterrai 10 NFT in più."
"you can share anywhere like telegram ,discord, whatsapp ...",你可以在任何地方分享，如telegram，discord，whatsapp......。,他にも、テレグラム、ディスコード、Whatsappなど、どこでも共有することができます。,"당신은 전보, 불화, WhatsApp에 같은 어디서나 공유 할 수 있습니다 ...","Anda dapat berbagi di mana saja seperti telegram, perselisihan, whatsapp ...","Sie können überall teilen wie Telegram, Discord, Whatsapp ...","vous pouvez partager n'importe où comme telegram ,discord, whatsapp ...","вы можете поделиться где угодно, например, телеграммой, диссертацией, что угодно...","è possibile condividere ovunque come telegram, discord, whatsapp ..."
Notice,注意事项,お知らせ,주의,Memperhatikan,Hinweis,Avis,Обратите внимание:,Avviso
"1 ip address, 1 device only 1 airdop trx address per day, that means if one user send more then 1 address, the others will be ignore.",1个IP地址，1个设备，每天只能发送1个airdop trx地址，也就是说如果一个用户发送超过1个地址，其他用户将被忽略。,1つのIPアドレス、1つのデバイスにつき、1日1つのエアドップトリックスアドレスのみとなります。,"수단은 하나의 사용자 전송 더 후 1 개 주소, 나머지는 무시 될 경우 있음 (1 개) IP 주소, 하루에 한 장치 만 1 airdop의 TRX 주소.","1 alamat ip, 1 perangkat hanya 1 airdop alamat trx per hari, yang berarti jika salah satu pengguna mengirim lebih dari 1 alamat, yang lain akan diabaikan.","1 IP-Adresse, 1 Gerät, nur 1 airdop trx-Adresse pro Tag, das heißt, wenn ein Benutzer mehr als 1 Adresse sendet, werden die anderen ignoriert.","1 adresse ip, 1 appareil seulement 1 adresse trx airdop par jour, ce qui signifie que si un utilisateur envoie plus de 1 adresse, les autres seront ignorés.","1 ip-адрес, 1 устройство только 1 airdop trx-адрес в день, это означает, что если один пользователь отправит более 1 адреса, остальные будут проигнорированы.","1 indirizzo ip, 1 dispositivo solo 1 indirizzo airdop trx al giorno, ciò significa che se un utente invia più di 1 indirizzo, gli altri saranno ignorati."
Extra Reward,额外奖励,追加報酬,추가 보상,ekstra Reward,Extra-Belohnung,Récompense supplémentaire,Дополнительное вознаграждение,Ricompensa extra
Already obtained,已经获得,すでに取得済み,이미 획득,sudah diperoleh,Bereits erhalten,Déjà obtenu,Уже полученный,Già ottenuto
Extra Reward,额外奖励,追加報酬,추가 보상,ekstra Reward,Extra-Belohnung,Récompense supplémentaire,Дополнительная премия,Ricompensa extra
Already obtained,已经获得,既に取得済み,이미 획득,sudah diperoleh,Bereits erhalten,Déjà obtenue,Уже полученный,Già ottenuto
"While the N1Swap exchange is in development, the N1Swap team's NFT project Pixelschain is now live and you can click the button to play with it.",虽然N1Swap交易所正在开发中，但N1Swap团队的NFT项目Pixelschain已经上线，你可以点击按钮来玩。,N1Swap取引所は開発中ですが、N1SwapチームのNFTプロジェクト「Pixelschain」は現在ライブ中で、ボタンをクリックして遊ぶことができます。,"N1Swap 교환이 개발 중일 때, N1Swap 팀의 NFT 프로젝트 Pixelschain 지금 살고이고 당신은 그것으로 재생 버튼을 클릭 할 수 있습니다.","Sementara bursa N1Swap dalam pembangunan, tim N1Swap ini NFT proyek Pixelschain sekarang hidup dan Anda dapat mengklik tombol untuk bermain dengan itu.","Während der N1Swap-Austausch in der Entwicklung ist, ist das NFT-Projekt Pixelschain des N1Swap-Teams jetzt live und Sie können auf den Button klicken, um damit zu spielen.","Alors que l'échange N1Swap est en cours de développement, le projet NFT Pixelschain de l'équipe N1Swap est maintenant en ligne et vous pouvez cliquer sur le bouton pour jouer avec.","В то время как обмен N1Swap находится в разработке, NFT-проект команды N1Swap ""Pixelschain"" теперь работает в режиме реального времени, и вы можете нажать кнопку, чтобы поиграть с ним.","Mentre lo scambio N1Swap è in sviluppo, il progetto NFT Pixelschain del team N1Swap è ora attivo e puoi cliccare sul pulsante per giocarci."
Visit,访问,訪問する,방문,Mengunjungi,Besuchen Sie,Visitez,Посетите .,Visita
"Share a new free airdrop token, N1Swap, which is based on a decentralized exchange on the Tron network and is expected to be officially released at the end of April. You can now get free NST tokens by filling in your wallet address.",分享一款新的免费空投代币N1Swap，该代币基于Tron网络上的去中心化交易所，预计将于4月底正式发布。现在只要填写钱包地址就可以获得免费的NST代币。,新しい無料のエアドロップトークンであるN1Swapを共有しましょう。このトークンはTronネットワーク上の分散型取引所をベースにしており、4月末には正式にリリースされる予定です。現在、ウォレットアドレスを入力することで、無料のNSTトークンを入手することができます。,"트론 네트워크에 분산 교환을 기반으로 공식적으로 4 월 말에 출시 될 것으로 예상되는 새로운 무료 공중 투하 토큰, N1Swap를 공유 할 수 있습니다. 당신은 지금 당신의 지갑 주소를 작성하여 무료 NST 토큰을 얻을 수 있습니다.","Bagi token airdrop bebas baru, N1Swap, yang didasarkan pada pertukaran desentralisasi pada jaringan Tron dan diharapkan akan resmi dirilis pada akhir April. Anda sekarang bisa mendapatkan token NST gratis dengan mengisi alamat dompet Anda.","Teilen Sie einen neuen kostenlosen Airdrop-Token, N1Swap, der auf einer dezentralen Börse im Tron-Netzwerk basiert und voraussichtlich Ende April offiziell veröffentlicht wird. Sie können jetzt kostenlose NST-Tokens erhalten, indem Sie Ihre Wallet-Adresse eingeben.","Partagez un nouveau jeton de largage gratuit, N1Swap, qui est basé sur un échange décentralisé sur le réseau Tron et devrait être officiellement lancé à la fin du mois d'avril. Vous pouvez maintenant obtenir des jetons NST gratuits en indiquant l'adresse de votre portefeuille.","Поделитесь новым бесплатным токеном для сброса птиц N1Swap, который основан на децентрализованной обмене в сети Tron и, как ожидается, будет официально выпущен в конце апреля. Теперь вы можете получить бесплатный токен NST, заполнив адрес своего кошелька.","Condividi un nuovo token gratuito airdrop, N1Swap, che si basa su uno scambio decentralizzato sulla rete Tron e dovrebbe essere rilasciato ufficialmente alla fine di aprile. Ora puoi ottenere gratuitamente i token NST inserendo il tuo indirizzo del portafoglio."
